Spotify_ID,Title,Artist,Year,Genre,lyrics,processed_lyrics,Degree Centrality,Betweenness Centrality,Closeness Centrality,Community,sentiment,polarity,subjectivity
4HDCLYli2SUdkq9OjmvhSD,BELIEVE IT,PARTYNEXTDOOR,2022,,"69 ContributorsTranslationsTürkçePortuguêsPARTYNEXTDOOR & Rihanna - BELIEVE IT (Traduzione Italiana)FrançaisBELIEVE IT Lyrics[Intro: Wale]
(Ayy Biz, good lookin', foo)

[Chorus: Rihanna & PARTYNEXTDOOR]
Hey
Best make me believe it (Best make me be—)
Best make me believe it
Believe you won't deceive me
Hey
Best make me believe it (Best make me believe it)
Best make me believe it (Best make me believe it)
Believe you won't deceive me

[Verse 1: PARTYNEXTDOOR, with Rihanna]
First you gotta forgive me
Let me know everything gon' be okay
Even if I come out with everything I did
Would you still punish me even though I did it a long time ago?
If so, let me know
If I propose, would you say no?
Would you break my heart?
Would you embarrass me or play your part?
Baby, don't fold, my heart is yours
You got the power, pussy power
You got the power, pussy power
The floor is yours, the time is ours
Hey, either believe me or you don't
Choose to believe me or you won't
If you leave me, I'm skull and bones, I'm dead, baby
You told me
You might also like[Chorus: Rihanna & PARTYNEXTDOOR]
Hey (Ooh)
Best make me believe it (Best make me be—)
Best make me believe it
Believe you won't deceive me
Hey
Best make me believe it (Best make me believe it)
Best make me believe it (Best make me believe it)
Believe you won't deceive me

[Verse 2: PARTYNEXTDOOR]
Bae
You told me that you'd kill me if I fuck up (Kill me if I fuck up)
You told me I'm a lucky motherfucker (Lucky motherfucker)
You love 'em, but you never ever trust 'em
Never ever trust me, no (Never trust me, no)
There's two sides to the story (Sides to the story)
And that girl got a good PR (Good PR)
I knew we'd never make it far
Because I like my bitches black and mama tar
Oh, woah
Tell me you love me 'cause I know they won't
They wanna fit in for the photoshoot
Put them aside, baby, I notice you
My niggas hype, baby, they hypin' you
My family like it, yeah, they likin' you
My mama WhatsApp and she Skype you
She wanna know what it do
You say, ""Either way, you...""
[Chorus: Rihanna]
Best make me believe it (Best make me be—)
Best make me believe it
Believe you won't deceive me
Hey
Best make me believe it (Best make me believe it)
Best make me believe it (Best make me believe it)
Believe you won't deceive me

[Outro: PARTYNEXTDOOR]
Bae30Embed","['contributorstranslationstürkçeportuguêspartynextdoor', 'rihanna', 'believe', 'traduzione', 'italiana', 'françaisbelieve', 'lyrics', 'intro', 'wale', 'ayy', 'biz', 'good', 'lookin', 'foo', 'chorus', 'rihanna', 'partynextdoor', 'hey', 'best', 'make', 'believe', 'best', 'make', 'best', 'make', 'believe', 'believe', 'wo', 'deceive', 'hey', 'best', 'make', 'believe', 'best', 'make', 'believe', 'best', 'make', 'believe', 'best', 'make', 'believe', 'believe', 'wo', 'deceive', 'verse', 'partynextdoor', 'rihanna', 'first', 'got', 'ta', 'forgive', 'let', 'know', 'everything', 'gon', 'okay', 'even', 'come', 'everything', 'would', 'still', 'punish', 'even', 'though', 'long', 'time', 'ago', 'let', 'know', 'propose', 'would', 'say', 'would', 'break', 'heart', 'would', 'embarrass', 'play', 'part', 'baby', 'fold', 'heart', 'got', 'power', 'pussy', 'power', 'got', 'power', 'pussy', 'power', 'floor', 'time', 'hey', 'either', 'believe', 'choose', 'believe', 'leave', 'skull', 'bones', 'dead', 'baby', 'told', 'might', 'also', 'like', 'chorus', 'rihanna', 'partynextdoor', 'hey', 'ooh', 'best', 'make', 'believe', 'best', 'make', 'best', 'make', 'believe', 'believe', 'wo', 'deceive', 'hey', 'best', 'make', 'believe', 'best', 'make', 'believe', 'best', 'make', 'believe', 'best', 'make', 'believe', 'believe', 'wo', 'deceive', 'verse', 'partynextdoor', 'bae', 'told', 'kill', 'fuck', 'kill', 'fuck', 'told', 'lucky', 'motherfucker', 'lucky', 'motherfucker', 'love', 'never', 'ever', 'trust', 'never', 'ever', 'trust', 'never', 'trust', 'two', 'sides', 'story', 'sides', 'story', 'girl', 'got', 'good', 'pr', 'good', 'pr', 'knew', 'never', 'make', 'far', 'like', 'bitches', 'black', 'mama', 'tar', 'oh', 'woah', 'tell', 'love', 'know', 'wan', 'na', 'fit', 'photoshoot', 'put', 'aside', 'baby', 'notice', 'niggas', 'hype', 'baby', 'hypin', 'family', 'like', 'yeah', 'likin', 'mama', 'whatsapp', 'skype', 'wan', 'na', 'know', 'say', 'either', 'way', 'chorus', 'rihanna', 'best', 'make', 'believe', 'best', 'make', 'best', 'make', 'believe', 'believe', 'wo', 'deceive', 'hey', 'best', 'make', 'believe', 'best', 'make', 'believe', 'best', 'make', 'believe', 'best', 'make', 'believe', 'believe', 'wo', 'deceive', 'outro', 'partynextdoor']",0.0002333722287047,0.0,0.0002333722287047,963,"Sentiment(polarity=0.6256410256410256, subjectivity=0.40854700854700865)",0.6256410256410256,0.40854700854700865
2Q99zPXVqCPN5RaZawvJWZ,Beautiful Monster,Ne-Yo,2011,,"16 ContributorsBeautiful Monster Lyrics[Verse 1]
All my life
And the hereafter
I've never seen
Seen one like you
You're a knife
Sharp and deadly
And it's me
That you cut into
But I don't mind
In fact I like it
Though I'm terrified
I'm turned on but scared of you

[Chorus]
She's a monster
Beautiful monster
Beautiful monster
But I don't mind
And I need her
Said I need her
Beautiful monster
But I don't mind

[Bridge]
No, I don't mind
(I don't mind, I don't, I don't mind...)
No, I don't mind
(I don't mind, I don't, I don't mind...)
No, I don't mind
(I don't mind, I don't, I don't mind...)
No, I don't mind
(I don't mind, I don't, I don't mind...)
See Ne-Yo LiveGet tickets as low as $89You might also like[Verse 2]
In her eyes
There's love and fire
In my heart
She's burning through
But I don't mind
In fact I like it
Though I'm terrified
I'm turned on but scared of you

[Chorus]
She's a monster
Beautiful monster
Beautiful monster
But I don't mind
And I need her
Said I need her
Beautiful monster
But I don't mind

[Bridge 2]
No I don't mind
Playing with my heart
And she's playing with my mind
And I don't mind I don't I don't mind
No I don't mind I don't I don't mind
No I don't mind I don't I don't mind
No I don't mind I don't I don't mind
(I don't mind I don't I don't mind) And I don't mind
(I don't mind I don't I don't mind) Said I don't mind
(I don't mind I don't I don't mind) And I don't mind
(I don't mind I don't I don't mind) Beautiful monster
[Chorus]
She's a monster
Beautiful monster
Beautiful monster
But I don't mind
And I need her
Said I need her
Beautiful monster
But I don't mind

[Outro]
(Said I don't mind I don't I don't mind...) No I don't mind
(I don't mind I don't I don't mind...) No I don't mind
(I don't mind I don't I don't mind... Oooo...) No I don't mind6Embed","['contributorsbeautiful', 'monster', 'lyrics', 'verse', 'life', 'hereafter', 'never', 'seen', 'seen', 'one', 'like', 'knife', 'sharp', 'deadly', 'cut', 'mind', 'fact', 'like', 'though', 'terrified', 'turned', 'scared', 'chorus', 'monster', 'beautiful', 'monster', 'beautiful', 'monster', 'mind', 'need', 'said', 'need', 'beautiful', 'monster', 'mind', 'bridge', 'mind', 'mind', 'mind', 'mind', 'mind', 'mind', 'mind', 'mind', 'mind', 'mind', 'mind', 'mind', 'see', 'liveget', 'tickets', 'low', 'might', 'also', 'like', 'verse', 'eyes', 'love', 'fire', 'heart', 'burning', 'mind', 'fact', 'like', 'though', 'terrified', 'turned', 'scared', 'chorus', 'monster', 'beautiful', 'monster', 'beautiful', 'monster', 'mind', 'need', 'said', 'need', 'beautiful', 'monster', 'mind', 'bridge', 'mind', 'playing', 'heart', 'playing', 'mind', 'mind', 'mind', 'mind', 'mind', 'mind', 'mind', 'mind', 'mind', 'mind', 'mind', 'mind', 'mind', 'mind', 'said', 'mind', 'mind', 'mind', 'mind', 'mind', 'mind', 'beautiful', 'monster', 'chorus', 'monster', 'beautiful', 'monster', 'beautiful', 'monster', 'mind', 'need', 'said', 'need', 'beautiful', 'monster', 'mind', 'outro', 'said', 'mind', 'mind', 'mind', 'mind', 'mind', 'mind', 'mind', 'mind', 'oooo']",0.0014002333722287,0.0,0.0014002333722287,92,"Sentiment(polarity=0.619642857142857, subjectivity=0.8607142857142858)",0.619642857142857,0.8607142857142858
1Fjz0ME9pzk553wH86m3ZZ,Schwarz zu blau,Peter Fox,2011,,"41 ContributorsSchwarz zu blau Lyrics[Songtext zu „Schwarz zu blau“]

[Part 1]
Komm' ausm Club, war schön gewesen
Stinke nach Suff, bin kaputt, ist 'n schönes Leben
Steig' über Schnapsleichen, die auf meinem Weg verwesen
Ich seh' die Ratten sich satt fressen im Schatten der Dönerläden
Stapf' durch die Kotze am Kotti, Junks sind benebelt
Atzen rotzen in die Gegend, benehm'n sich daneben (Woo!)
Szene-Schnösel auf verzweifelter Suche nach der Szene
Gepiercte Mädels, die woll'n, dass ich strassenfeger lese, eh!
Halb sechs, meine Augen brenn'n
Tret' auf 'n Typen, der zwischen toten Tauben pennt
Hysterische Bräute keifen und haben Panik, denn
An der Ecke gibt es Stress zwischen Tarek und Sam
Tarek sagt: „Halt's Maul oder ich werd' dir ins Gesicht schlagen!“
Sam hat die Hosen voll, aber kann auch nicht nichts sagen
Die rote Suppe tropft auf den Asphalt
Mir wird schlecht, ich mach' die Jacke zu, denn es ist kalt

[Hook]
Guten Morgen, Berlin, du kannst so hässlich sein
So dreckig und grau
Du kannst so schön schrecklich sein
Deine Nächte fressen mich auf
Es wird für mich wohl das Beste sein
Ich geh' nach Hause und schlaf' mich aus
Und während ich durch die Straßen lauf'
Wird langsam Schwarz zu Blau
You might also like[Bridge]
Müde Gestalten im Neonlicht
Mit tiefen Falten im Gesicht
Die Frühschicht schweigt, jeder bleibt für sich
Frust kommt auf, denn der Bus kommt nicht

[Part 2]
Und überall liegt Scheiße, man muss eigentlich schweben
Jeder hat 'n Hund, aber kein'n zum Reden
Ich atme ständig durch den Mund, das ist Teil meines Lebens
Ich fühl' mich ungesund, brauch' was Reines dagegen, ah
Ich hab' 'n dicken Kopf, ich muss 'n Saft haben
Ich hab' dringlichen Bock auf Bagdads Backwar'n
Da ist es warm, da geb' ich mich meinen Träumen hin
Bei Fatima, der süßen Backwarenverkäuferin
R&B-Balladen pumpen ausm parkenden Benz (Ouhh)
Feierabend für die Straßengangs
'n Hooligan liegt 'ner Frau in den Armen und flennt
Diese Stadt ist eben doch gar nicht so hart, wie du denkst

[Hook]
Guten Morgen, Berlin, du kannst so hässlich sein
So dreckig und grau
Du kannst so schön schrecklich sein
Deine Nächte fressen mich auf
Es wird für mich wohl das Beste sein
Ich geh' nach Hause und schlaf' mich aus
Und während ich durch die Straßen lauf'
Wird langsam Schwarz zu Blau
Ich bin kaputt und reib' mir aus
Meinen Augen deinen Staub
Du bist nicht schön und das weißt du auch
Dein Panorama versaut
Siehst nicht mal schön von Weit'm aus
Doch die Sonne geht grade auf
Und ich weiß, ob ich will oder nicht
Dass ich dich zum Atmen brauch'7Embed","['contributorsschwarz', 'zu', 'blau', 'lyrics', 'songtext', 'zu', 'schwarz', 'zu', 'blau', 'part', 'komm', 'ausm', 'club', 'war', 'schön', 'gewesen', 'stinke', 'nach', 'suff', 'bin', 'kaputt', 'ist', 'schönes', 'leben', 'steig', 'über', 'schnapsleichen', 'die', 'auf', 'meinem', 'weg', 'verwesen', 'ich', 'seh', 'die', 'ratten', 'sich', 'satt', 'fressen', 'im', 'schatten', 'der', 'dönerläden', 'stapf', 'durch', 'die', 'kotze', 'kotti', 'junks', 'sind', 'benebelt', 'atzen', 'rotzen', 'die', 'gegend', 'sich', 'daneben', 'woo', 'auf', 'verzweifelter', 'suche', 'nach', 'der', 'szene', 'gepiercte', 'mädels', 'die', 'dass', 'ich', 'strassenfeger', 'lese', 'eh', 'halb', 'sechs', 'meine', 'augen', 'tret', 'auf', 'typen', 'der', 'zwischen', 'toten', 'tauben', 'pennt', 'hysterische', 'bräute', 'keifen', 'und', 'haben', 'panik', 'denn', 'der', 'ecke', 'gibt', 'es', 'stress', 'zwischen', 'tarek', 'und', 'sam', 'tarek', 'sagt', 'halt', 'maul', 'oder', 'ich', 'werd', 'dir', 'ins', 'gesicht', 'schlagen', 'sam', 'hat', 'die', 'hosen', 'voll', 'aber', 'kann', 'auch', 'nicht', 'nichts', 'sagen', 'die', 'rote', 'suppe', 'tropft', 'auf', 'den', 'asphalt', 'mir', 'wird', 'schlecht', 'ich', 'mach', 'die', 'jacke', 'zu', 'denn', 'es', 'ist', 'kalt', 'hook', 'guten', 'morgen', 'berlin', 'du', 'kannst', 'hässlich', 'sein', 'dreckig', 'und', 'grau', 'du', 'kannst', 'schön', 'schrecklich', 'sein', 'deine', 'nächte', 'fressen', 'mich', 'auf', 'es', 'wird', 'für', 'mich', 'wohl', 'das', 'beste', 'sein', 'ich', 'geh', 'nach', 'hause', 'und', 'schlaf', 'mich', 'aus', 'und', 'während', 'ich', 'durch', 'die', 'straßen', 'wird', 'langsam', 'schwarz', 'zu', 'blau', 'might', 'also', 'like', 'bridge', 'müde', 'gestalten', 'im', 'neonlicht', 'mit', 'tiefen', 'falten', 'im', 'gesicht', 'die', 'frühschicht', 'schweigt', 'jeder', 'bleibt', 'für', 'sich', 'frust', 'kommt', 'auf', 'denn', 'der', 'bus', 'kommt', 'nicht', 'part', 'und', 'überall', 'liegt', 'scheiße', 'man', 'muss', 'eigentlich', 'schweben', 'jeder', 'hat', 'hund', 'aber', 'zum', 'reden', 'ich', 'atme', 'ständig', 'durch', 'den', 'mund', 'das', 'ist', 'teil', 'meines', 'lebens', 'ich', 'fühl', 'mich', 'ungesund', 'brauch', 'reines', 'dagegen', 'ah', 'ich', 'hab', 'dicken', 'kopf', 'ich', 'muss', 'saft', 'haben', 'ich', 'hab', 'dringlichen', 'bock', 'auf', 'bagdads', 'da', 'ist', 'es', 'warm', 'da', 'geb', 'ich', 'mich', 'meinen', 'träumen', 'hin', 'bei', 'fatima', 'der', 'süßen', 'backwarenverkäuferin', 'r', 'pumpen', 'ausm', 'parkenden', 'benz', 'ouhh', 'feierabend', 'für', 'die', 'straßengangs', 'hooligan', 'liegt', 'frau', 'den', 'armen', 'und', 'flennt', 'diese', 'stadt', 'ist', 'eben', 'doch', 'gar', 'nicht', 'hart', 'wie', 'du', 'denkst', 'hook', 'guten', 'morgen', 'berlin', 'du', 'kannst', 'hässlich', 'sein', 'dreckig', 'und', 'grau', 'du', 'kannst', 'schön', 'schrecklich', 'sein', 'deine', 'nächte', 'fressen', 'mich', 'auf', 'es', 'wird', 'für', 'mich', 'wohl', 'das', 'beste', 'sein', 'ich', 'geh', 'nach', 'hause', 'und', 'schlaf', 'mich', 'aus', 'und', 'während', 'ich', 'durch', 'die', 'straßen', 'wird', 'langsam', 'schwarz', 'zu', 'blau', 'ich', 'bin', 'kaputt', 'und', 'reib', 'mir', 'aus', 'meinen', 'augen', 'deinen', 'staub', 'du', 'bist', 'nicht', 'schön', 'und', 'das', 'weißt', 'du', 'auch', 'dein', 'panorama', 'versaut', 'siehst', 'nicht', 'mal', 'schön', 'von', 'weit', 'aus', 'doch', 'die', 'sonne', 'geht', 'grade', 'auf', 'und', 'ich', 'weiß', 'ob', 'ich', 'oder', 'nicht', 'dass', 'ich', 'dich', 'zum', 'atmen']",0.0004667444574095,0.0,0.0004667444574095,767,"Sentiment(polarity=0.6, subjectivity=0.6)",0.6,0.6
1qYKWcEOrh2tM8PlgIm8K1,Sunday Best,Surfaces,2021,,"68 ContributorsSunday Best Lyrics[Intro: Forrest]
Good, feeling good

[Chorus: Forrest]
Ayy, feeling good, like I should
Went and took a walk around the neighborhood
Feeling blessed, never stressed
Got that sunshine on my Sunday best (Yeah, ayy, ayy)

[Verse 1: Forrest]
Every day can be a better day, despite the challenge
All you gotta do is leave it better than you found it
It's gonna get difficult to stand, but hold your balance
I just say whatever 'cause there is no way around it 'cause

[Pre-Chorus: Forrest]
Everyone falls down sometimes
But you just gotta know it'll all be fine
It's okay, uh-huh-huh, uh
It's okay, it's okay

[Chorus: Forrest]
Ayy, feeling good like I should
Went and took a walk around the neighborhood
Feeling blessed, never stressed
Got that sunshine on my Sunday best (Ayy)
You might also like[Verse 2: Forrest]
Some days you wake up and nothing works, you feel surrounded
Gotta give your feet some gravity to get you grounded
Keep good things inside your ears just like the waves and sound did
And just say whatever 'cause there is no way around it

[Pre-Chorus: Forrest]
Everyone falls down sometimes
But you just gotta know it'll all be fine
It's okay, uh-huh-huh, uh
It's okay, it's okay

[Chorus: Forrest]
Ayy, feeling good, like I should
Went and took a walk around the neighborhood
Feeling blessed, never stressed
Got that sunshine on my Sunday best
Ayy, feeling good, like I should
Went and took a walk around the neighborhood
Feeling blessed, never stressed
Got that sunshine on my Sunday best23Embed","['contributorssunday', 'best', 'lyrics', 'intro', 'forrest', 'good', 'feeling', 'good', 'chorus', 'forrest', 'ayy', 'feeling', 'good', 'like', 'went', 'took', 'walk', 'around', 'neighborhood', 'feeling', 'blessed', 'never', 'stressed', 'got', 'sunshine', 'sunday', 'best', 'yeah', 'ayy', 'ayy', 'verse', 'forrest', 'every', 'day', 'better', 'day', 'despite', 'challenge', 'got', 'ta', 'leave', 'better', 'found', 'gon', 'na', 'get', 'difficult', 'stand', 'hold', 'balance', 'say', 'whatever', 'way', 'around', 'forrest', 'everyone', 'falls', 'sometimes', 'got', 'ta', 'know', 'fine', 'okay', 'uh', 'okay', 'okay', 'chorus', 'forrest', 'ayy', 'feeling', 'good', 'like', 'went', 'took', 'walk', 'around', 'neighborhood', 'feeling', 'blessed', 'never', 'stressed', 'got', 'sunshine', 'sunday', 'best', 'ayy', 'might', 'also', 'like', 'verse', 'forrest', 'days', 'wake', 'nothing', 'works', 'feel', 'surrounded', 'got', 'ta', 'give', 'feet', 'gravity', 'get', 'grounded', 'keep', 'good', 'things', 'inside', 'ears', 'like', 'waves', 'sound', 'say', 'whatever', 'way', 'around', 'forrest', 'everyone', 'falls', 'sometimes', 'got', 'ta', 'know', 'fine', 'okay', 'uh', 'okay', 'okay', 'chorus', 'forrest', 'ayy', 'feeling', 'good', 'like', 'went', 'took', 'walk', 'around', 'neighborhood', 'feeling', 'blessed', 'never', 'stressed', 'got', 'sunshine', 'sunday', 'best', 'ayy', 'feeling', 'good', 'like', 'went', 'took', 'walk', 'around', 'neighborhood', 'feeling', 'blessed', 'never', 'stressed', 'got', 'sunshine', 'sunday']",0.0002333722287047,0.0,0.0002333722287047,71,"Sentiment(polarity=0.5927536231884057, subjectivity=0.5130434782608696)",0.5927536231884057,0.5130434782608696
7M9XTtbz6qDg7LqYJ7OpJB,Real Love,Clean Bandit,2015,,"24 ContributorsReal Love Lyrics[Verse 1: Jess Glynne]
Oh, you've got the feeling that I wanna feel
Oh, you've got the feeling that I know is real, real, real

[Pre-Chorus: Jess Glynne]
It's in the way you look, it's in the way you love
And I can see that this is real, real
It's in the way you talk, it's in the way you touch
And I can see

[Chorus: Jess Glynne]
This is real, real, real, real love
This is real, real, real, real love
You give me that feeling, you give me that feeling
You give me that, you give me real love
You give me that feeling, you give me that feeling
You give me that, you give me real love

[Verse 2: Jess Glynne]
Oh, before you I was searching for a rarity
Oh, you showed me things I never thought that I would see

[Pre-Chorus: Jess Glynne]
It's in the way you look, it's in the way you love
And I can see that this is real, real
It's in the way you talk, it's in the way you touch
And I can see
You might also like[Chorus: Jess Glynne]
This is real, real, real, real love
This is real, real, real, real love
You give me that feeling, you give me that feeling
You give me that, you give me real love
You give me that feeling, you give me that feeling
You give me that, you give me real love

[Bridge: Jess Glynne]
Time won't waste, and we just learn
To take it slow and wait our turn
Held my breath, cause I believe
That you'll find me

[Chorus: Jess Glynne]
Real, real, real, real love
This is real, real, real, real love
You give me that love, real love
You give me that love, real love
You give me that love, real love
You give me that love

[Chorus: Jess Glynne]
This is real, real, real, real love
This is real, real, real, real love
This is real, real, real, real love
This is real, real, real, real love
You give me that love, real love
You give me that love, real love
You give me that love, real love
You give me that love
You give me that love, real love
You give me that love, real love
You give me that love, real love
You give me that love29Embed","['contributorsreal', 'love', 'lyrics', 'verse', 'jess', 'glynne', 'oh', 'got', 'feeling', 'wan', 'na', 'feel', 'oh', 'got', 'feeling', 'know', 'real', 'real', 'real', 'jess', 'glynne', 'way', 'look', 'way', 'love', 'see', 'real', 'real', 'way', 'talk', 'way', 'touch', 'see', 'chorus', 'jess', 'glynne', 'real', 'real', 'real', 'real', 'love', 'real', 'real', 'real', 'real', 'love', 'give', 'feeling', 'give', 'feeling', 'give', 'give', 'real', 'love', 'give', 'feeling', 'give', 'feeling', 'give', 'give', 'real', 'love', 'verse', 'jess', 'glynne', 'oh', 'searching', 'rarity', 'oh', 'showed', 'things', 'never', 'thought', 'would', 'see', 'jess', 'glynne', 'way', 'look', 'way', 'love', 'see', 'real', 'real', 'way', 'talk', 'way', 'touch', 'see', 'might', 'also', 'like', 'chorus', 'jess', 'glynne', 'real', 'real', 'real', 'real', 'love', 'real', 'real', 'real', 'real', 'love', 'give', 'feeling', 'give', 'feeling', 'give', 'give', 'real', 'love', 'give', 'feeling', 'give', 'feeling', 'give', 'give', 'real', 'love', 'bridge', 'jess', 'glynne', 'time', 'wo', 'waste', 'learn', 'take', 'slow', 'wait', 'turn', 'held', 'breath', 'cause', 'believe', 'find', 'chorus', 'jess', 'glynne', 'real', 'real', 'real', 'real', 'love', 'real', 'real', 'real', 'real', 'love', 'give', 'love', 'real', 'love', 'give', 'love', 'real', 'love', 'give', 'love', 'real', 'love', 'give', 'love', 'chorus', 'jess', 'glynne', 'real', 'real', 'real', 'real', 'love', 'real', 'real', 'real', 'real', 'love', 'real', 'real', 'real', 'real', 'love', 'real', 'real', 'real', 'real', 'love', 'give', 'love', 'real', 'love', 'give', 'love', 'real', 'love', 'give', 'love', 'real', 'love', 'give', 'love', 'give', 'love', 'real', 'love', 'give', 'love', 'real', 'love', 'give', 'love', 'real', 'love', 'give']",0.0023337222870478,0.0,0.0023337222870478,1473,"Sentiment(polarity=0.5686046511627907, subjectivity=0.7209302325581395)",0.5686046511627907,0.7209302325581395
0iSaO7CfL9NgXdM8Meu2ul,Beautiful People,Chris Brown,2015,,"27 ContributorsBeautiful People Lyrics[Chorus]
Everywhere everywhere, everywhere I go
Everywhere that I've been the only thing I see is
Is beautiful people, beautiful people
Beautiful people, beautiful people
Oh-woah, don't you know? Don't you know?
Oh-woah, you're beautiful, don't you know?
Oh-woah, don't you know? Don't you know?
Oh-woah, beautiful, don't you know, know, know?

[Verse 1]
Live your life, live your life, let the love inside
It's your life, it's your life
Your beauty's deep inside, inside you
Don't let 'em bring you down, no
The beauty is inside you
Don't let 'em bring you down, no

[Chorus]
Oh-woah, don't you know? Don't you know?
Oh-woah, you're beautiful, don't you know?
Oh-woah, don't you know? Don't you know?
Oh-woah, beautiful, don't you know, know, know?
Know, know, know, know, know
Know, know, know, know, know
Know, know, know, know, know
See Chris Brown LiveGet tickets as low as $134You might also like[Verse 2]
Take your time, take your time, take your sexy time
Don't lose your head, lose your head
Your beauty's deep inside, inside you
Don't let 'em bring you down, no
The beauty is inside you
Don't let 'em bring you down, no

[Chorus]
Oh-woah, don't you know? Don't you know?
Oh-woah, you're beautiful, don't you know?
Oh-woah, don't you know? Don't you know?
Oh-woah, beautiful, don't you know, know, know?
Know, know, know, know, know
Know, know, know, know, know
Know, know, know, know, know

[Post-Chorus]
Beautiful people, beautiful people
Beautiful people, beautiful people

[Outro]
Live your life, live your life, let the love inside
It's your life, it's your life, got to live it right
Beautiful people20Embed","['contributorsbeautiful', 'people', 'lyrics', 'chorus', 'everywhere', 'everywhere', 'everywhere', 'go', 'everywhere', 'thing', 'see', 'beautiful', 'people', 'beautiful', 'people', 'beautiful', 'people', 'beautiful', 'people', 'know', 'know', 'beautiful', 'know', 'know', 'know', 'beautiful', 'know', 'know', 'know', 'verse', 'live', 'life', 'live', 'life', 'let', 'love', 'inside', 'life', 'life', 'beauty', 'deep', 'inside', 'inside', 'let', 'bring', 'beauty', 'inside', 'let', 'bring', 'chorus', 'know', 'know', 'beautiful', 'know', 'know', 'know', 'beautiful', 'know', 'know', 'know', 'know', 'know', 'know', 'know', 'know', 'know', 'know', 'know', 'know', 'know', 'know', 'know', 'know', 'know', 'know', 'see', 'chris', 'brown', 'liveget', 'tickets', 'low', 'might', 'also', 'like', 'verse', 'take', 'time', 'take', 'time', 'take', 'sexy', 'time', 'lose', 'head', 'lose', 'head', 'beauty', 'deep', 'inside', 'inside', 'let', 'bring', 'beauty', 'inside', 'let', 'bring', 'chorus', 'know', 'know', 'beautiful', 'know', 'know', 'know', 'beautiful', 'know', 'know', 'know', 'know', 'know', 'know', 'know', 'know', 'know', 'know', 'know', 'know', 'know', 'know', 'know', 'know', 'know', 'know', 'beautiful', 'people', 'beautiful', 'people', 'beautiful', 'people', 'beautiful', 'people', 'outro', 'live', 'life', 'live', 'life', 'let', 'love', 'inside', 'life', 'life', 'got', 'live', 'right', 'beautiful']",0.0046674445740956,0.0,0.0046674445740956,566,"Sentiment(polarity=0.5636123136123136, subjectivity=0.7902116402116404)",0.5636123136123136,0.7902116402116404
